CREATE TABLE da_person (id BIGINT PRIMARY KEY, name VARCHAR);
CREATE TABLE

CREATE TABLE da_follows (id BIGINT PRIMARY KEY, src_id BIGINT, dst_id BIGINT, weight INT);
CREATE TABLE

INSERT INTO da_person VALUES (1, 'A'), (2, 'B'), (3, 'C'), (4, 'D');
INSERT 0 4

INSERT INTO da_follows VALUES (1, 1, 2, 10), (2, 2, 3, 20), (3, 1, 3, 30);
INSERT 0 3

CREATE PROPERTY GRAPH da_graph
VERTEX TABLES (
    da_person LABEL Node
)
EDGE TABLES (
    da_follows
        SOURCE KEY (src_id) REFERENCES da_person (id)
        DESTINATION KEY (dst_id) REFERENCES da_person (id)
        LABEL Follows
);
CREATE PROPERTY GRAPH

SELECT * FROM GRAPH_TABLE(da_graph
    MATCH (a:Node WHERE a.name = 'A')-[e:Follows]->(b:Node)
    COLUMNS (a.name AS src, b.name AS dst)
) gt
ORDER BY dst;
gt.src	gt.dst
A	B
A	C

SELECT * FROM GRAPH_TABLE(da_graph
    MATCH ANY SHORTEST (a:Node WHERE a.name = 'A')-[e:Follows]->{1,3}(b:Node)
    COLUMNS (a.name AS src, b.name AS dst)
) gt
ORDER BY dst;
gt.src	gt.dst
A	B
A	C

INSERT INTO da_follows VALUES (4, 1, 4, 40);
INSERT 0 1

DROP PROPERTY GRAPH da_graph;
DROP PROPERTY GRAPH

CREATE PROPERTY GRAPH da_graph
VERTEX TABLES (
    da_person LABEL Node
)
EDGE TABLES (
    da_follows
        SOURCE KEY (src_id) REFERENCES da_person (id)
        DESTINATION KEY (dst_id) REFERENCES da_person (id)
        LABEL Follows
);
CREATE PROPERTY GRAPH

SELECT * FROM GRAPH_TABLE(da_graph
    MATCH (a:Node WHERE a.name = 'A')-[e:Follows]->(b:Node)
    COLUMNS (a.name AS src, b.name AS dst)
) gt
ORDER BY dst;
gt.src	gt.dst
A	B
A	C
A	D

DELETE FROM da_follows WHERE id = 3;
DELETE 1

DROP PROPERTY GRAPH da_graph;
DROP PROPERTY GRAPH

CREATE PROPERTY GRAPH da_graph
VERTEX TABLES (
    da_person LABEL Node
)
EDGE TABLES (
    da_follows
        SOURCE KEY (src_id) REFERENCES da_person (id)
        DESTINATION KEY (dst_id) REFERENCES da_person (id)
        LABEL Follows
);
CREATE PROPERTY GRAPH

SELECT * FROM GRAPH_TABLE(da_graph
    MATCH (a:Node WHERE a.name = 'A')-[e:Follows]->(b:Node)
    COLUMNS (a.name AS src, b.name AS dst)
) gt
ORDER BY dst;
gt.src	gt.dst
A	B
A	D

SELECT * FROM GRAPH_TABLE(da_graph
    MATCH ANY SHORTEST (a:Node WHERE a.name = 'A')-[e:Follows]->{1,3}(b:Node)
    COLUMNS (a.name AS src, b.name AS dst)
) gt
ORDER BY dst;
gt.src	gt.dst
A	B
A	C
A	D

INSERT INTO da_follows VALUES (5, 3, 1, 50);
INSERT 0 1

INSERT INTO da_follows VALUES (6, 4, 2, 60);
INSERT 0 1

DELETE FROM da_follows WHERE id = 2;
DELETE 1

DROP PROPERTY GRAPH da_graph;
DROP PROPERTY GRAPH

CREATE PROPERTY GRAPH da_graph
VERTEX TABLES (
    da_person LABEL Node
)
EDGE TABLES (
    da_follows
        SOURCE KEY (src_id) REFERENCES da_person (id)
        DESTINATION KEY (dst_id) REFERENCES da_person (id)
        LABEL Follows
);
CREATE PROPERTY GRAPH

SELECT * FROM GRAPH_TABLE(da_graph
    MATCH (a:Node)-[e:Follows]->(b:Node)
    COLUMNS (a.name AS src, b.name AS dst)
) gt
ORDER BY src, dst;
gt.src	gt.dst
A	B
A	D
C	A
D	B

SELECT * FROM GRAPH_TABLE(da_graph
    MATCH ANY SHORTEST (a:Node WHERE a.name = 'A')-[e:Follows]->{1,3}(b:Node)
    COLUMNS (a.name AS src, b.name AS dst)
) gt
ORDER BY dst;
gt.src	gt.dst
A	B
A	D

DROP PROPERTY GRAPH da_graph;
DROP PROPERTY GRAPH

DROP TABLE da_follows;
DROP TABLE

DROP TABLE da_person;
DROP TABLE
